{
  "schemaType": "nansen.fragment",
  "schemaVersion": "0.1.0",
  "id": "ophys.fov_position",
  "version": "1.0.0",
  "title": "FOV position",
  "description": "Where the field of view is on the cortex, in mm from bregma, and its size, as dev's fovmanager keeps them. Placed on the FOV map page.",
  "columns": [
    {
      "name": "fov_ml",
      "dataType": "number",
      "title": "FOV ML",
      "unit": "mm",
      "description": "Mediolateral position of the FOV's centre (right is positive)"
    },
    {
      "name": "fov_ap",
      "dataType": "number",
      "title": "FOV AP",
      "unit": "mm",
      "description": "Anteroposterior position of the FOV's centre (anterior is positive)"
    },
    {
      "name": "fov_width_um",
      "dataType": "number",
      "title": "FOV width",
      "unit": "µm"
    },
    {
      "name": "fov_height_um",
      "dataType": "number",
      "title": "FOV height",
      "unit": "µm"
    }
  ]
}
